{"schema_version":"1.0.0","last_verified_at":"2026-08-20T03:27:26+01:00","verification_timezone":"Europe/London","policy":{"external_discovery_required_before_bespoke":true,"popularity_never_overrides_fit_or_licence":true,"code_and_asset_licences_are_separate":true,"rechallenge_days":30,"ranking_weights":{"task_fit":30,"maintenance":20,"licence_provenance":20,"integration_cost":10,"docs_tests":10,"platform_fit":5,"popularity":5}},"entries":[{"entry_id":"reuse.godot-demo-projects","name":"Godot demo projects","category":"official_template_collection","canonical_url":"https://github.com/godotengine/godot-demo-projects","source_type":"github_repository","source_revision_status":"immutable_commit","version_or_revision":"34fc99545fc41520a958248f607101e7d0b95b05","last_verified_at":"2026-08-20T03:27:26+01:00","evidence_status":"SOURCE-VERIFIED","licensing":{"code_license":"MIT","asset_license":"Individual demo assets require path-level provenance review before production copying.","license_class":"permissive","boundary_status":"code_and_assets_separated","commercial_use_status":"allowed_with_conditions"},"adoption_status":"drop_in_candidate","fit":{"engine_or_stack":"Godot 4.x; select a revision compatible with the target stable engine","platforms":["desktop","web","mobile where selected demo supports it"],"maintenance_signal":"active","integration_effort":"low"},"risk":{"dependency_burden":"low","supply_chain":"low","licence":"low"},"popularity_snapshot":{"stars":9372,"forks":2215,"observed_at":"2026-08-20T03:27:26+01:00"},"notes":"Official solved-system source for controllers, physics, navigation, rendering, UI and template patterns. Popularity is only a discovery signal; exact demo/version/asset boundaries still gate reuse."},{"entry_id":"reuse.dialogic","name":"Dialogic 2","category":"mechanic_framework","canonical_url":"https://github.com/dialogic-godot/dialogic","source_type":"github_repository","source_revision_status":"immutable_commit","version_or_revision":"fd0fa22c335c72583b89b35699f9fb19dd1b4eae","last_verified_at":"2026-08-20T03:27:26+01:00","evidence_status":"SOURCE-VERIFIED","licensing":{"code_license":"MIT","asset_license":"Roboto is Apache-2.0; project/game assets authored around Dialogic remain separate.","license_class":"permissive","boundary_status":"code_and_assets_separated","commercial_use_status":"allowed_with_conditions"},"adoption_status":"drop_in_candidate","fit":{"engine_or_stack":"Godot 4.3+ according to pinned upstream documentation","platforms":["Godot-supported targets subject to project validation"],"maintenance_signal":"active","integration_effort":"medium"},"risk":{"dependency_burden":"medium","supply_chain":"medium","licence":"low"},"popularity_snapshot":{"stars":5922,"forks":344,"observed_at":"2026-08-20T03:27:26+01:00"},"notes":"Mature dialogue/visual-novel/character framework. Pin exact version and regression-test public APIs before production adoption."},{"entry_id":"reuse.kenney-starter-3d-platformer","name":"Kenney Starter Kit 3D Platformer","category":"starter_kit","canonical_url":"https://github.com/KenneyNL/Starter-Kit-3D-Platformer","source_type":"github_repository","source_revision_status":"immutable_commit","version_or_revision":"3fa8a04b1c01ab23db43123d4ce814a34c3fc7f0","last_verified_at":"2026-08-20T03:27:26+01:00","evidence_status":"SOURCE-VERIFIED","licensing":{"code_license":"MIT","asset_license":"Pinned README states bundled sprites, 3D models and sound effects are CC0.","license_class":"permissive","boundary_status":"code_and_assets_separated","commercial_use_status":"allowed_with_conditions"},"adoption_status":"drop_in_candidate","fit":{"engine_or_stack":"Godot 4.6","platforms":["desktop","web","mobile after target-device validation"],"maintenance_signal":"stable","integration_effort":"low"},"risk":{"dependency_burden":"low","supply_chain":"low","licence":"low"},"popularity_snapshot":{"stars":1205,"forks":175,"observed_at":"2026-08-20T03:27:26+01:00"},"notes":"High-leverage complete starter: character controller/double jump, collectibles, falling platforms, camera controls, gamepad and CC0 production inputs. Execute on the chosen Godot version before promotion."},{"entry_id":"reuse.dialogue-manager","name":"Dialogue Manager for Godot","category":"mechanic_framework","canonical_url":"https://github.com/nathanhoad/godot_dialogue_manager","source_type":"github_repository","source_revision_status":"immutable_commit","version_or_revision":"e37b2e0d784e238bb936e0485dcee1a8e307a8f3","last_verified_at":"2026-08-20T03:27:26+01:00","evidence_status":"SOURCE-VERIFIED","licensing":{"code_license":"MIT","asset_license":"No bundled production asset licence is inferred from the code licence.","license_class":"permissive","boundary_status":"single_code_licence_reviewed","commercial_use_status":"allowed_with_conditions"},"adoption_status":"component_candidate","fit":{"engine_or_stack":"Godot 4","platforms":["Godot-supported targets subject to project validation"],"maintenance_signal":"active","integration_effort":"medium"},"risk":{"dependency_burden":"low","supply_chain":"low","licence":"low"},"popularity_snapshot":{"stars":3790,"forks":268,"observed_at":"2026-08-20T03:27:26+01:00"},"notes":"Alternative mature nonlinear dialogue framework. It should compete with Dialogic for the actual game context rather than both being installed."},{"entry_id":"reuse.limboai","name":"LimboAI","category":"mechanic_framework","canonical_url":"https://github.com/limbonaut/limboai","source_type":"github_repository","source_revision_status":"immutable_commit","version_or_revision":"a6f5c7fc11ff80d512dd75c82cfa85724fd8a742","last_verified_at":"2026-08-20T03:27:26+01:00","evidence_status":"SOURCE-VERIFIED","licensing":{"code_license":"MIT","asset_license":"Demo/project art has separate attribution requirements and must not inherit the MIT code assumption.","license_class":"permissive","boundary_status":"code_and_assets_separated","commercial_use_status":"allowed_with_conditions"},"adoption_status":"component_candidate","fit":{"engine_or_stack":"Godot 4","platforms":["Godot-supported targets subject to project validation"],"maintenance_signal":"active","integration_effort":"medium"},"risk":{"dependency_burden":"medium","supply_chain":"medium","licence":"medium"},"popularity_snapshot":{"stars":2965,"forks":139,"observed_at":"2026-08-20T03:27:26+01:00"},"notes":"Behavior trees and state machines can remove AI-framework work when NPC complexity justifies them; trivial enemies should stay native/simple if the framework costs more than it saves."},{"entry_id":"reuse.openttd","name":"OpenTTD","category":"whole_game_reference","canonical_url":"https://github.com/OpenTTD/OpenTTD","source_type":"github_repository","source_revision_status":"immutable_commit","version_or_revision":"4d4f8bff38d200fbcfda11789bd69259ebbefd17","last_verified_at":"2026-08-20T03:27:26+01:00","evidence_status":"SOURCE-VERIFIED","licensing":{"code_license":"GPL-2.0 with documented third-party exceptions","asset_license":"Base-set/game content and third-party components retain separate licence boundaries.","license_class":"copyleft","boundary_status":"mixed_requires_per_item_review","commercial_use_status":"blocked_for_drop_in"},"adoption_status":"architecture_reference","fit":{"engine_or_stack":"C++ whole-game architecture","platforms":["desktop","server","multiple packaged platforms"],"maintenance_signal":"active","integration_effort":"reference_only"},"risk":{"dependency_burden":"high","supply_chain":"medium","licence":"high"},"popularity_snapshot":{"stars":null,"forks":null,"observed_at":"2026-08-20T03:27:26+01:00"},"notes":"High-value complete-game reference for simulation, save/load, networking, content/mod systems and long-lived operations. GPL means no silent proprietary drop-in."},{"entry_id":"reuse.kenney","name":"Kenney game assets","category":"asset_library","canonical_url":"https://www.kenney.nl/assets","source_type":"official_website","source_revision_status":"mutable_web_snapshot","version_or_revision":"support-and-asset-pages-retrieved@2026-08-20T03:27:26+01:00","last_verified_at":"2026-08-20T03:27:26+01:00","evidence_status":"SOURCE-VERIFIED","licensing":{"code_license":"N/A","asset_license":"Current Kenney asset pages state CC0/public-domain terms; production intake records exact pack URL/files and included licence.","license_class":"public_domain","boundary_status":"single_asset_licence_reviewed","commercial_use_status":"allowed_with_conditions"},"adoption_status":"asset_source_candidate","fit":{"engine_or_stack":"engine-neutral 2D/3D/audio asset source","platforms":["desktop","web","mobile"],"maintenance_signal":"active","integration_effort":"low"},"risk":{"dependency_burden":"low","supply_chain":"low","licence":"low"},"popularity_snapshot":{"stars":null,"forks":null,"observed_at":"2026-08-20T03:27:26+01:00"},"notes":"Search this source before generating generic game art/audio. Mutable web metadata is discovery evidence, not immutable per-pack provenance."},{"entry_id":"reuse.cc0-asset-index","name":"CC0 Asset Index","category":"asset_discovery","canonical_url":"https://github.com/Jpalmer95/cc0-asset-index","source_type":"github_repository","source_revision_status":"immutable_commit","version_or_revision":"ca53d0e7d50e5a05960625710b9105102c3f16f1","last_verified_at":"2026-08-20T03:27:26+01:00","evidence_status":"SOURCE-VERIFIED","licensing":{"code_license":"MIT","asset_license":"Indexer records upstream CC0/public-domain candidates; every selected upstream asset must still be frozen and independently retained with provider provenance.","license_class":"permissive","boundary_status":"code_and_assets_separated","commercial_use_status":"allowed_with_conditions"},"adoption_status":"asset_discovery_candidate","fit":{"engine_or_stack":"Python CLI + engine-agnostic asset catalog","platforms":["Blender","Godot","Unreal","engine-agnostic workflows"],"maintenance_signal":"active","integration_effort":"low"},"risk":{"dependenc